{
  "$ref": "#/definitions/certifications",
  "definitions": {
    "certifications": {
      "type": "object",
      "properties": {
        "title": {
          "type": "string"
        },
        "desc": {
          "type": "string"
        },
        "hero": {
          "type": "object",
          "properties": {
            "eyebrow": {
              "type": "string"
            },
            "title": {
              "type": "string"
            },
            "text": {
              "type": "string"
            },
            "tipTitle": {
              "type": "string"
            },
            "tipText": {
              "type": "string"
            },
            "themes": {
              "type": "array",
              "items": {
                "type": "string"
              }
            }
          },
          "required": [
            "eyebrow",
            "title",
            "text",
            "tipTitle",
            "tipText",
            "themes"
          ],
          "additionalProperties": false
        },
        "empty": {
          "type": "string"
        },
        "emptyDash": {
          "type": "string"
        },
        "dashLink": {
          "type": "string"
        },
        "cats": {
          "type": "object",
          "additionalProperties": {
            "type": "object",
            "properties": {
              "title": {
                "type": "string"
              },
              "text": {
                "type": "string"
              },
              "empty": {
                "type": "string"
              }
            },
            "additionalProperties": false
          }
        },
        "btnProof": {
          "type": "string"
        },
        "otherPill": {
          "type": "string"
        },
        "contact": {
          "type": "object",
          "properties": {
            "title": {
              "type": "string"
            },
            "text": {
              "type": "string"
            }
          },
          "required": [
            "title",
            "text"
          ],
          "additionalProperties": false
        },
        "$schema": {
          "type": "string"
        }
      },
      "required": [
        "title",
        "desc",
        "hero",
        "empty",
        "emptyDash",
        "dashLink",
        "cats",
        "btnProof",
        "otherPill",
        "contact"
      ],
      "additionalProperties": false
    }
  },
  "$schema": "http://json-schema.org/draft-07/schema#"
}