{
    "title": "Anton Meier Ebsen Jørgensen – Certificeringer",
    "desc": "Certificeringer i Python, MATLAB, SAS m.m.",
    "hero": {
        "eyebrow": "Certificeringer",
        "title": "Kurser, badges og dokumentation",
        "text": "Samlet oversigt over mine certificeringer inden for programmering, dataanalyse og formidling. Jeg linker til beviser når muligt.",
        "tipTitle": "Tip",
        "tipText": "Når du tilføjer nye certs: hold titler ensartede og skriv 1 linje om “hvad kan jeg nu”. Det er 10/10 mere værd end “jeg har taget et kursus”.",
        "themes": [
            "Data",
            "Coding",
            "Økonomi",
            "Formidling"
        ]
    },
    "empty": "Ingen certificeringer fundet endnu.",
    "emptyDash": "Tilføj dine diplomer i",
    "dashLink": "Dashboardet",
    "cats": {
        "python": {
            "title": "Python",
            "text": "Dataanalyse, workflows, og praktisk programmering.",
            "empty": "Ingen Python certificeringer endnu."
        },
        "matlab": {
            "title": "MATLAB",
            "text": "Numerisk analyse, matrixregning og workflows.",
            "empty": "Ingen MATLAB certificeringer endnu."
        },
        "sas": {
            "title": "SAS",
            "text": "Tidsrækker, data management og analyse.",
            "empty": "Ingen SAS certificeringer endnu."
        },
        "writing": {
            "title": "Politikens Skriveakademi",
            "text": "Skrivning, struktur og formidling.",
            "empty": "Ingen Formidlings-certificeringer endnu."
        }
    },
    "btnProof": "Bevis",
    "otherPill": "Andet",
    "contact": {
        "title": "Vil du se CV’et samlet?",
        "text": "Certificeringer er “bilag”. CV’et er “historien”. Begge dele har sin plads."
    }
}