{
    "title": "Anton Meier Ebsen Jørgensen – Certifications",
    "desc": "Certifications in Python, MATLAB, SAS, and more.",
    "hero": {
        "eyebrow": "Certifications",
        "title": "Courses, Badges, and Documentation",
        "text": "A comprehensive overview of my certifications in programming, data analysis, and communication. I link to certificates and credentials whenever possible.",
        "tipTitle": "Tip",
        "tipText": "When adding new certifications: keep titles consistent and write a one-line summary of \"what can I do now\". It's 10/10 more valuable than \"I took a course\".",
        "themes": [
            "Data",
            "Coding",
            "Economics",
            "Communication"
        ]
    },
    "empty": "No certifications found yet.",
    "emptyDash": "Add your credentials in the",
    "dashLink": "Dashboard",
    "cats": {
        "python": {
            "title": "Python",
            "text": "Data analysis, workflows, and practical programming.",
            "empty": "No Python certifications yet."
        },
        "matlab": {
            "title": "MATLAB",
            "text": "Numerical analysis, matrix algebra, and workflows.",
            "empty": "No MATLAB certifications yet."
        },
        "sas": {
            "title": "SAS",
            "text": "Time series, data management, and analysis.",
            "empty": "No SAS certifications yet."
        },
        "writing": {
            "title": "Writing & Communication",
            "text": "Writing, structure, and professional communication.",
            "empty": "No writing certifications yet."
        }
    },
    "btnProof": "Proof",
    "otherPill": "Other",
    "contact": {
        "title": "Want to see the full CV?",
        "text": "Certifications are 'appendices'. The CV is the 'story'. Both have their place."
    }
}